ID,AGM district name,Transect name,Transect continuation name,River,Major river,"Reference reach (if ""Reference"", ref. reach; if name of reach, that reach is ref. reach for this row)",Transect full display name,Transect display name,Reference km start,Reference km end,Reference period start,Reference period end,Country,Continent,Mining type,Secondary mining type,Land use,Mining onset,Onset year confidence,Mining ceased,Transect for multiple mining districts,Transect begins downstream of mining,Upstream km unmapped,Upstream km unmapped exact,Transect begins upstream of mining,Upstream km unaffected,Upstream km unaffected exact,"If temporary upstream unaffected, year of affected",Transect begins upstream of mining tributary junction,River km of tributary junction,River km of tributary junction exact,If transect at tributary is secondary,News articles,Notes,...36,country_display,continent_display,site_no,transect_name,ref_reach
agm0001,angola_andrada_diamond_region,angola_andrada_diamond_region,,,,angola_andrada_diamond_region,Angola Andrada,Andrada,0,79,1984,2021,Angola,Africa,Diamonds,,,1980,high,,Yes,Yes,,,Yes,79,Yes,,Yes,113,Exact,,,Formal diamond mining area with long history. Present at beginning of Landsat record. Major expansion with several new mines and likely some informal/exploratory activity in mid-2000s and 2010s.,,Angola,Africa,angola_andrada_diamond_region,angola_andrada_diamond_region,angola_andrada_diamond_region
agm0002,angola_chicapa_river_middle_agm_region,angola_chicapa_river_middle_agm_region,,,,angola_andrada_diamond_region,Angola Chicapa Middle,Chicapa Middle,0,79,1984,2021,Angola,Africa,Diamonds,,,2010,medium,,Yes,Yes,,,,,,,,,,,,Minor mostly informal mining area. Presumably primarily or exclusively for diamonds.,,Angola,Africa,angola_chicapa_river_middle_agm_region,angola_chicapa_river_middle_agm_region,angola_andrada_diamond_region
agm0003,angola_chicapa_upper_diamond_region,angola_chicapa_river_middle_agm_region,,,,angola_andrada_diamond_region,Angola Chicapa Middle,Chicapa Middle,0,79,1984,2021,Angola,Africa,Diamonds,,,1980,high,,Yes,Yes,,,,,,,,,,,,Major mostly formal diamond mining with long history. Mining present at beginning of Landsat record. Steady expansion.,,Angola,Africa,angola_chicapa_river_middle_agm_region,angola_chicapa_river_middle_agm_region,angola_andrada_diamond_region
agm0004,angola_chissundo_diamond_region,angola_chissundo_diamond_region,,,,angola_andrada_diamond_region,Angola Chissundo,Chissundo,0,79,1984,2021,Angola,Africa,Diamonds,,,1980,high,,,,,,,,,,,,,,,Formal diamond mining area with long history. Present at beginning of Landsat record. Major expansion with several new mines and likely some informal/exploratory activity in mid-2000s and 2010s.,,Angola,Africa,angola_chissundo_diamond_region,angola_chissundo_diamond_region,angola_andrada_diamond_region
agm0005,angola_kwango_river_cafunfo_diamond_region,angola_kwango_river_cafunfo_diamond_region,,,,angola_andrada_diamond_region,Angola Kwango,Kwango,0,79,1984,2021,Angola,Africa,Diamonds,,,1980,high,,Yes,No,,,Yes,120,Exact,,,,,,,Major diamond mining area with long history. Present at beginning of Landsat record. Major expansion during the 2000s.,,Angola,Africa,angola_kwango_river_cafunfo_diamond_region,angola_kwango_river_cafunfo_diamond_region,angola_andrada_diamond_region
agm0006,angola_magambundi_diamond_region,angola_magambundi_diamond_region,,,,angola_andrada_diamond_region,Angola Magambundi,Magambundi,0,79,1984,2021,Angola,Africa,Diamonds,,,1980,high,,,,,,,,,,,,,,,Major diamond mines. Present at beginning of Landsat record.,,Angola,Africa,angola_magambundi_diamond_region,angola_magambundi_diamond_region,angola_andrada_diamond_region
agm0007,angola_maludi_diamond_region,angola_andrada_diamond_region,,,,angola_andrada_diamond_region,Angola Andrada,Andrada,0,79,1984,2021,Angola,Africa,Diamonds,,,2004,high,,Yes,Yes,,,,,,,Yes,79,Exact,,,Formal diamond mining area with long history. Present at beginning of Landsat record. Major expansion with several new mines and likely some informal/exploratory activity in mid-2000s and 2010s.,,Angola,Africa,angola_andrada_diamond_region,angola_andrada_diamond_region,angola_andrada_diamond_region
agm0008,angola_mua_senge_mining_region_TSTM,angola_kwango_river_cafunfo_diamond_region,,,,angola_andrada_diamond_region,Angola Kwango,Kwango,0,79,1984,2021,Angola,Africa,Diamonds,,,2000,high,,Yes,Yes,,,,,,,Yes,80,Exact,,,Small diamond mining area. Begins in 2000. Seems to be sporadically active.,,Angola,Africa,angola_kwango_river_cafunfo_diamond_region,angola_kwango_river_cafunfo_diamond_region,angola_andrada_diamond_region
agm0009,bolivia_achipiri_agm_region,bolivia_mapiri_agm_region,,,,bolivia_mapiri_agm_region,Bolivia Mapiri,Mapiri,35,,1984,2010,Bolivia,South America,Gold,,,2010,high,,,,,,,,,,,35,Exact,,https://news.mongabay.com/2016/10/gold-rush-in-bolivia-sparks-conflict-between-miners-and-the-community/,Small mining area in mountainous area. Tributaries are too small to map.,,Bolivia,S. Am,bolivia_mapiri_agm_region,bolivia_mapiri_agm_region,bolivia_mapiri_agm_region
agm0010,bolivia_charopampa_agm_region,bolivia_mapiri_agm_region,,,,bolivia_mapiri_agm_region,Bolivia Mapiri,Mapiri,81,,1984,2004,Bolivia,South America,Gold,,,2004,low,,,,,,,,,,,81,Exact,,https://news.mongabay.com/2016/10/gold-rush-in-bolivia-sparks-conflict-between-miners-and-the-community/,Small mining area in mountainous area. Tributaries are too small to map.,,Bolivia,S. Am,bolivia_mapiri_agm_region,bolivia_mapiri_agm_region,bolivia_mapiri_agm_region
agm0011,bolivia_mapiri_agm_region,bolivia_mapiri_agm_region,,,,bolivia_mapiri_agm_region,Bolivia Mapiri,Mapiri,0,,1984,2010,Bolivia,South America,Gold,,,2010,high,,,,,,,,,,,,,,https://news.mongabay.com/2016/10/gold-rush-in-bolivia-sparks-conflict-between-miners-and-the-community/,Major mining area mostly along main stem of river in narrow valley. Begins in 2010s and expands rapidly.,,Bolivia,S. Am,bolivia_mapiri_agm_region,bolivia_mapiri_agm_region,bolivia_mapiri_agm_region
agm0012,bolivia_mayaya_agm_region,bolivia_mayaya_agm_region,bolivia_mapiri_agm_region,,,bolivia_mayaya_agm_region,Bolivia Mayaya,Mayaya,0,,1984,2005,Bolivia,South America,Gold,,,2005,medium,,No,Yes,,,,,,,,80,Exact,Secondary,https://news.mongabay.com/2016/10/gold-rush-in-bolivia-sparks-conflict-between-miners-and-the-community/,"Major mining area mostly along a tributary. Begins in mid-2000s, but poor imagery. Major expansion in 2010s.",,Bolivia,S. Am,bolivia_mayaya_agm_region,bolivia_mayaya_agm_region,bolivia_mayaya_agm_region
agm0013,brazil_floresta_do_amana_agm_region,brazil_floresta_do_amana_agm_region,,,,brazil_floresta_do_amana_agm_region,Brazil Floresta,Floresta,0,,1995,2000,Brazil,South America,Gold,,,1980,high,,No,Yes,,,,,,,No,,,,,"Intense mining area with long history. Present at beginning of Landsat record. Rapid expansion in 1980s. Stasis in the 1990s. Possible abandonment in 2000s, but difficult to tell. Major expansion in late 2010s.",,Brazil,S. Am,brazil_floresta_do_amana_agm_region,brazil_floresta_do_amana_agm_region,brazil_floresta_do_amana_agm_region
agm0014,brazil_jamanxim_river_agm_region,brazil_jamanxim_river_agm_region,,,,brazil_jamanxim_river_agm_region,Branzil Jamanxim,Jamanxim,0,,1995,2000,Brazil,South America,Gold,,,1987,high,,Yes,Yes,,,,,,,,,,,,Small miningarea with long history. Begins in late 1980s. Active through 1990s. Inactive during 2000s. Some new activity in 2010s.,,Brazil,S. Am,brazil_jamanxim_river_agm_region,brazil_jamanxim_river_agm_region,brazil_jamanxim_river_agm_region
agm0015,brazil_jamanxim_river_jardim_do_ouro_agm_region,brazil_rio_novo_upper_agm_region,,,,brazil_rio_novo_upper_agm_region,Brazil Novo,Novo,0,400,1984,2021,Brazil,South America,Gold,,,1980,high,,Yes,Yes,20,Approximate,Yes,400,Approximate,,,,,,,"Small intense mining area with long history. Present at beginning of Landsat record. Rapid expansion in 1980s. Stasis in the 1990s. Possible abandonment in 2000s, but difficult to tell. Active in late 2010s.",,Brazil,S. Am,brazil_rio_novo_upper_agm_region,brazil_rio_novo_upper_agm_region,brazil_rio_novo_upper_agm_region
agm0016,brazil_kayapo_preserve_agm_region,brazil_kayapo_preserve_agm_region,,,,brazil_kayapo_preserve_agm_region,Brazil Kayapo,Kayapo,0,,2005,2010,Brazil,South America,Gold,,,1980,high,,Yes,Yes,,,,,,,,,,,,"Major mining area with long and complicated history. Present at beginning of Landsat record. Abruptly abandoned in early 1990s, seemingly 1995, due to enforcement action. Mining appears to resume after long hiatus in 2012, with rapid expansion in mid-2010s and explosion in late 2010s early 2020s.",,Brazil,S. Am,brazil_kayapo_preserve_agm_region,brazil_kayapo_preserve_agm_region,brazil_kayapo_preserve_agm_region
agm0017,brazil_kayapo_preserve_north_agm_region,brazil_kayapo_preserve_agm_region,,,,brazil_kayapo_preserve_agm_region,Brazil Kayapo,Kayapo,0,,2005,2010,Brazil,South America,Gold,,,1980,high,,Yes,No,,,,,,,Yes,,Exact,,,"Mining area with long and complicated history. Present at beginning of Landsat record. Abruptly abandoned in early 1990s, seemingly 1995, due to enforcement action. Mining appears to resume after long hiatus in 2015, with rapid expansion in mid-2010s and explosion in late 2010s early 2020s.",,Brazil,S. Am,brazil_kayapo_preserve_agm_region,brazil_kayapo_preserve_agm_region,brazil_kayapo_preserve_agm_region
agm0018,brazil_lourenco_agm_region,brazil_lourenco_agm_region,,,,brazil_lourenco_agm_region,Brazil Lourenco,Lourenco,0,,2005,2010,Brazil,South America,Gold,,,1980,high,,No,Yes,,,,,,,No,,,,,Small mining area with long history. Present at beginning of Landsat record. High activity in 1980s and 1990s. Seemingly abandoned in 2000s. New activity and possible minor expansion in 2010s.,,Brazil,S. Am,brazil_lourenco_agm_region,brazil_lourenco_agm_region,brazil_lourenco_agm_region
agm0019,brazil_luar_da_praia_agm_region,brazil_luar_da_praia_agm_region,,,,brazil_luar_da_praia_agm_region,Branzil Luar da Praia,Luar da Praia,0,,2000,2010,Brazil,South America,Gold,,,1986,high,,No,Yes,,,,,,,,,,,,"Small mining area. Mining begins in late 1980s, just after beginning of Landsat record. High activity in 1980s and early 1990s. Seemingly abandoned in 2000s. Remining of area begins around 2012 continues to 2022.",,Brazil,S. Am,brazil_luar_da_praia_agm_region,brazil_luar_da_praia_agm_region,brazil_luar_da_praia_agm_region
agm0020,brazil_morada_do_sol_agm_region,brazil_morada_do_sol_agm_region,,,,brazil_morada_do_sol_agm_region,Brazil Morada do Sol,Morada do Sol,0,,2000,2010,Brazil,South America,Gold,,,1980,high,,No,Yes,,,,,,,,,,,,Small mining area with long history. Present at beginning of Landsat record. High activity in 1980s and 1990s. Seemingly abandoned in 2000s. Major remining activities begin in 2014.,,Brazil,S. Am,brazil_morada_do_sol_agm_region,brazil_morada_do_sol_agm_region,brazil_morada_do_sol_agm_region
agm0021,brazil_rio_crepori_agm_region,brazil_rio_crepori_agm_region,brazil_rio_tapajos_upper_agm_region,,,brazil_rio_crepori_agm_region,Brazil Crepori,Crepori,0,,2005,2015,Brazil,South America,Gold,,,1980,high,,No,Yes,,,,,,,Yes,212,Exact,Secondary,,Large intense mining area with long history. Present at beginning of Landsat record. Rapid expansion in 1980s. Stasis in the 1990s. Expansion in late 2010s.,,Brazil,S. Am,brazil_rio_crepori_agm_region,brazil_rio_crepori_agm_region,brazil_rio_crepori_agm_region
agm0022,brazil_rio_novo_agm_region,brazil_rio_novo_upper_agm_region,,,,brazil_rio_novo_upper_agm_region,Brazil Novo,Novo,0,211,1984,1988,Brazil,South America,Gold,,,1980,high,,Yes,Yes,20,Approximate,Temporary,211,Exact,1987,Yes,211,Exact,,,"Small intense mining area with long history. Present at beginning of Landsat record. Rapid expansion in 1980s. Stasis in the 1990s. Possible abandonment in 2000s, but difficult to tell. Active in late 2010s.",,Brazil,S. Am,brazil_rio_novo_upper_agm_region,brazil_rio_novo_upper_agm_region,brazil_rio_novo_upper_agm_region
agm0023,brazil_rio_novo_upper_agm_region,brazil_rio_novo_upper_agm_region,,,,brazil_rio_novo_upper_agm_region,Brazil Novo,Novo,0,211,1984,1988,Brazil,South America,Gold,,,1987,high,,Yes,Yes,20,Approximate,No,,,,No,,,,,Small intense mining area with long history. Begins sharply in late 1980s. Persists to present.,,Brazil,S. Am,brazil_rio_novo_upper_agm_region,brazil_rio_novo_upper_agm_region,brazil_rio_novo_upper_agm_region
agm0024,brazil_rio_tapajos_porto_rico_agm_region,brazil_rio_tapajos_porto_rico_agm_region,brazil_rio_tapajos_upper_agm_region,,,brazil_rio_tapajos_porto_rico_agm_region,Brazil Tapajos Porto Rico,Tapajos Porto Rico,0,,2005,2015,Brazil,South America,Gold,,,1980,high,,No,Yes,50,Approximate,No,,,,Yes,150,Exact,Secondary,,"Small intense mining area with long history. Present at beginning of Landsat record. Rapid expansion in 1980s. Stasis in the 1990s. Possible abandonment in 2000s, but difficult to tell. Expansion in late 2010s.",,Brazil,S. Am,brazil_rio_tapajos_porto_rico_agm_region,brazil_rio_tapajos_porto_rico_agm_region,brazil_rio_tapajos_porto_rico_agm_region
agm0025,brazil_rio_tapajos_trib_1_agm_region,brazil_rio_tapajos_trib_1_agm_region,brazil_rio_tapajos_upper_agm_region,,,brazil_rio_tapajos_trib_1_agm_region,Brazil Tapajos A,Tapajos A,0,,2000,2010,Brazil,South America,Gold,,,1980,high,,No,Yes,,,,,,,Yes,278,Exact,Secondary,,"Small intense mining area with long history. Present at beginning of Landsat record. Rapid expansion in 1980s. Stasis in the 1990s. Possible abandonment in 2000s, but difficult to tell. Expansion in late 2010s.",,Brazil,S. Am,brazil_rio_tapajos_trib_1_agm_region,brazil_rio_tapajos_trib_1_agm_region,brazil_rio_tapajos_trib_1_agm_region
agm0026,brazil_rio_tapajos_trib_2_agm_region,brazil_rio_tapajos_trib_2_agm_region,brazil_rio_tapajos_upper_agm_region,,,brazil_rio_tapajos_trib_2_agm_region,Brazil Tapajos B,Tapajos B,0,,2000,2010,Brazil,South America,Gold,,,1980,high,,No,Yes,,,,,,,Yes,243,Exact,Secondary,,"Small intense mining area with long history. Present at beginning of Landsat record. Rapid expansion in 1980s. Stasis in the 1990s. Possible abandonment in 2000s, but difficult to tell. Expansion in late 2010s.",,Brazil,S. Am,brazil_rio_tapajos_trib_2_agm_region,brazil_rio_tapajos_trib_2_agm_region,brazil_rio_tapajos_trib_2_agm_region
agm0027,brazil_rio_tapajos_upper_agm_region,brazil_rio_tapajos_upper_agm_region,,,,brazil_rio_tapajos_upper_agm_region,Brazil Tapajos Upper,Tapajos Upper,0,,2000,2010,Brazil,South America,Gold,,,1980,high,,Yes,Yes,,,,,,,No,,,,,"Small intense mining area with long history. Present at beginning of Landsat record. Rapid expansion in 1980s. Stasis in the 1990s. Possible abandonment in 2000s, but difficult to tell. Expansion in late 2010s.",,Brazil,S. Am,brazil_rio_tapajos_upper_agm_region,brazil_rio_tapajos_upper_agm_region,brazil_rio_tapajos_upper_agm_region
agm0028,brazil_rio_tocantins_upper_agm_region,brazil_rio_tocantins_upper_agm_region,brazil_rio_novo_upper_agm_region,,,brazil_rio_tocantins_upper_agm_region,Brazil Tocantins,Tocantins,0,,2000,2005,Brazil,South America,Gold,,,1980,high,,No,Yes,300,Approximate,No,,,,,468,Exact,Secondary,,"Small intense mining area with long history. Present at beginning of Landsat record. Rapid expansion in 1980s. Stasis in the 1990s. Possible abandonment in 2000s, but difficult to tell. Major expansion in late 2010s.",,Brazil,S. Am,brazil_rio_tocantins_upper_agm_region,brazil_rio_tocantins_upper_agm_region,brazil_rio_tocantins_upper_agm_region
agm0029,brazil_riozinho_das_arraias_agm_region_TSTM,brazil_jamanxim_river_agm_region,,,,brazil_jamanxim_river_agm_region,Brazil Jamanxim,Jamanxim,287,,2000,2005,Brazil,South America,Gold,,,1980,high,,,,,,,,,,Yes,287,Exact,,,Small mining area with long history.,,Brazil,S. Am,brazil_jamanxim_river_agm_region,brazil_jamanxim_river_agm_region,brazil_jamanxim_river_agm_region
agm0030,brazil_upper_madeira_agm_region_TSTM,NA,,,,,,,,,,,Brazil,South America,Gold,,,1980,high,,,,,,,,,,,,,,,Old mining area on tiny tributaries with frequent remining. Slow expansion and contraction over the decades.,,Brazil,S. Am,NA,NA,
agm0031,brazil_xingu_river_taboca_agm_region_TSTM,brazil_kayapo_preserve_agm_region,,,,brazil_kayapo_preserve_agm_region,Brazil Kayapo,Kayapo,0,,2005,2010,Brazil,South America,Gold,,,1980,high,,No,Yes,,,,,,,,,,,,Small mining area along first-order tributary to Xingu River.,,Brazil,S. Am,brazil_kayapo_preserve_agm_region,brazil_kayapo_preserve_agm_region,brazil_kayapo_preserve_agm_region
agm0032,cameroon_kadei_river_agm_region,cameroon_kadei_river_agm_region,,,,cameroon_kadei_river_agm_region,Cameroon Kadei,Kadei,0,,1984,2008,Cameroon,Africa,Gold,,,2011,medium,,Yes,Yes,,,,,,,,,,,,Major mining area in headwaters of Kadei River. Begins in early 2010s. Rapid expansion in late 2010s.,,Cameroon,Africa,cameroon_kadei_river_agm_region,cameroon_kadei_river_agm_region,cameroon_kadei_river_agm_region
agm0033,cameroon_kadei_river_batouri_agm_region,cameroon_kadei_river_agm_region,,,,cameroon_kadei_river_agm_region,Cameroon Kadei,Kadei,144,,1984,2008,Cameroon,Africa,Gold,,,2009,high,,Yes,Yes,,,,,,,Yes,144,Exact,,https://www.voanews.com/a/africa_cameroon-clears-illegal-miners-border-village-after-landslide-kills-27/6206520.html,Small mining area along a first-order tributary of the Kadei River.,,Cameroon,Africa,cameroon_kadei_river_agm_region,cameroon_kadei_river_agm_region,cameroon_kadei_river_agm_region
agm0034,cameroon_lom_river_betare_agm_region,cameroon_lom_river_agm_region,,,,cameroon_lom_river_agm_region,Cameroon Lom,Lom,118,,1984,2007,Cameroon,Africa,Gold,,,2007,high,,,,,,,,,,Yes,118,Exact,,,Major mining area  along main stem of Lom River. Begins in late 2000s and expands steadily. Lom River where transect begins is dammed beginning in 2015. Reservoir begins at km 144.,,Cameroon,Africa,cameroon_lom_river_agm_region,cameroon_lom_river_agm_region,cameroon_lom_river_agm_region
agm0035,cameroon_lom_river_wakaso_agm_region,cameroon_lom_river_agm_region,,,,cameroon_lom_river_agm_region,Cameroon Lom,Lom,0,,1984,2007,Cameroon,Africa,Gold,,,2011,medium,,,,,,,,,,,,,,,Major mining area in headwaters of Lom River. Begins in early 2010s and expands steadily. Major expansion to tributaries in 2016. Stream very small for mapping. Downstream Lom River where transect begins is dammed beginning in 2015. Reservoir begins at km 144.,,Cameroon,Africa,cameroon_lom_river_agm_region,cameroon_lom_river_agm_region,cameroon_lom_river_agm_region
agm0036,central_african_republic_kadei_river_sosso_agm_region,cameroon_kadei_river_agm_region,,,,cameroon_kadei_river_agm_region,Cameroon Kadei,Kadei,299,,1984,2008,Central African Republic,Africa,Gold,,,2010,high,,Yes,Yes,,,,,,,Yes,299,Exact,,Time lapse since 2016: https://www.planet.com/stories/central-african-republic-sosso-kadei-river-pkpdAFQ7g,Small mining area along several first-order tributaries of the Kadei River.,,C. African Rep.,Africa,cameroon_kadei_river_agm_region,cameroon_kadei_river_agm_region,cameroon_kadei_river_agm_region
agm0037,central_african_republic_mambere_river_abba_agm_region,central_african_republic_mambere_river_abba_agm_region,,,,cameroon_lom_river_agm_region,CAR Mambere,Mambere,0,118,1984,2007,Central African Republic,Africa,Gold,,,2010,medium,,Yes,Yes,,,,,,,,,,,,Mining begins in early 2010s. Major expansion in 2018 widens tributary and substantially increases mining footprint.,,C. African Rep.,Africa,central_african_republic_mambere_river_abba_agm_region,central_african_republic_mambere_river_abba_agm_region,cameroon_lom_river_agm_region
agm0038,central_african_republic_mambere_river_carnot_agm_region,central_african_republic_mambere_river_abba_agm_region,,,,cameroon_lom_river_agm_region,CAR Mambere,Mambere,0,118,1984,2007,Central African Republic,Africa,Gold,,,1980,low,,,,,,,,,,Yes,108,Exact,,,"Small mining area with long history. Present at beginning of Landsat record, though there are no images from the 1990s and possibly 1980s. Not clear that there is much ongoing activity at this location.",,C. African Rep.,Africa,central_african_republic_mambere_river_abba_agm_region,central_african_republic_mambere_river_abba_agm_region,cameroon_lom_river_agm_region
agm0039,central_african_republic_mambere_trib_agm_region,central_african_republic_mambere_river_abba_agm_region,,,,cameroon_lom_river_agm_region,CAR Mambere,Mambere,0,118,1984,2007,Central African Republic,Africa,Gold,,,1980,low,,,,,,,,,,Yes,96,Exact,,,"Dispersed mining along tributary to Mambere River. Unclear origin and duration, but mining extends much of the length of the river.",,C. African Rep.,Africa,central_african_republic_mambere_river_abba_agm_region,central_african_republic_mambere_river_abba_agm_region,cameroon_lom_river_agm_region
agm0040,colombia_atrato_river_bebarama_agm_region_TSTM,colombia_rio_quito_quibdo_agm_region,,,,colombia_rio_quito_quibdo_agm_region,Colombia Quito,Quito,130,,1984,2007,Colombia,South America,Gold,,,2009,medium,,No,Yes,60,Approximate,No,,,,Yes,130,Approximate,,,Small dense mining area along Atrato River tributaries. Rapid expansion in 2010s.,,Colombia,S. Am,colombia_rio_quito_quibdo_agm_region,colombia_rio_quito_quibdo_agm_region,colombia_rio_quito_quibdo_agm_region
agm0041,colombia_cano_bijara_agm_region_TSTM,NA,,,,,,,,,,,Colombia,South America,Gold,,,2015,low,,,,,,,,,,,,,,,Small streamside mining area. Not much presence or hydrologic impact so far.,,Colombia,S. Am,NA,NA,
agm0042,colombia_cienaga_el_popal_agm_region_TSTM,NA,,,,,,,,,,,Colombia,South America,Gold,,,1980,high,,No,Yes,,,,,,,,,,,,Small intense mining area with long history. Present in first Landsat images. Abandoned in late 1990s but remining begins in late 2000s.,,Colombia,S. Am,NA,NA,
agm0043,colombia_cordoba_agm_region_TSTM,NA,,,,,,,,,,,Colombia,South America,Gold,,,2009,high,,NA,NA,100,Approximate,NA,,,,,,,,,"Mid-size mining area on several adjacent headwater tributaries. All too small to map, run directly into a reservoir that could be mapped.",,Colombia,S. Am,NA,NA,
agm0044,colombia_gran_colombia_agm_region_TSTM,NA,,,,,,,,,,,Colombia,South America,Gold,,,1980,high,,No,Yes,,,,,,,,,,,,"Small mountain and headwater stream mining area. Not much hydrologic expression and tiny streams, so too small to map.",,Colombia,S. Am,NA,NA,
agm0045,colombia_mona_agm_region,colombia_mona_agm_region,,,,colombia_mona_agm_region,Colombia Mona,Mona,0,,1984,2010,Colombia,South America,Gold,,,2010,high,,No,Yes,,,,,,,,,,,,"Small mining district on low-order streams. Begins in 2010 and expands rapidly. Mining not restriced to channel, occurs on terraces and hillsides.",,Colombia,S. Am,colombia_mona_agm_region,colombia_mona_agm_region,colombia_mona_agm_region
agm0046,colombia_norosi_agm_region_TSTM,NA,,,,,,,,,,,Colombia,South America,Gold,,,2010,high,,No,Yes,,,,,,,,,,,,Major mining area on low-order stream.,,Colombia,S. Am,NA,NA,
agm0047,colombia_pueblo_nuevo_agm_region_TSTM,NA,,,,,,,,,,,Colombia,South America,Gold,,,2012,high,,No,Yes,,,,,,,,,,,,Small mining area on low-order stream.,,Colombia,S. Am,NA,NA,
agm0048,colombia_rio_bagre_upper_agm_region_TSTM,colombia_nechi,,,,,Colombia Nechi,Nechi,,,,,Colombia,South America,Gold,,,2012,medium,,Yes,Yes,,,,,,,,,,,,Mining area in many tributaries upstream of main Nechi River mining area. Begins later than downstream mining districts. Begins in early 2010s and rapidly expands to all nearby tributaries.,,Colombia,S. Am,colombia_nechi,colombia_nechi,
agm0049,colombia_rio_calima_bajo_agm_region,colombia_rio_calima_bajo_agm_region,,,,colombia_rio_calima_bajo_agm_region,Colombia Calima,Calima,0,,1984,2010,Colombia,South America,Gold,,,2013,medium,,No,Yes,6,Exact,No,,,,No,,,,,Small mining area in first-order tributary of San Juan River.,,Colombia,S. Am,colombia_rio_calima_bajo_agm_region,colombia_rio_calima_bajo_agm_region,colombia_rio_calima_bajo_agm_region
agm0050,colombia_rio_caqueta_puerto_limon_agm_region_TSTM,NA,,,,,,,,,,,Colombia,South America,Gold,,,2013,low,,,,,,,,,,,,,,,,,Colombia,S. Am,NA,NA,
agm0051,colombia_rio_mata_agm_region_TSTM,NA,,,,,,,,,,,Colombia,South America,Gold,,,2008,high,,,,,,,,,,,,,,,Small mining area in headwaters of colombia_antioquia_agm_region. Too small to map but many kilometres of affected streams. Beginning in 2009.,,Colombia,S. Am,NA,NA,
agm0052,colombia_rio_quito_quibdo_agm_region,colombia_rio_quito_quibdo_agm_region,,,,colombia_rio_quito_quibdo_agm_region,Colombia Quito,Quito,0,,1984,2010,Colombia,South America,Gold,,,2010,medium,,Yes,Yes,130,Approximate,No,,,,No,,,,,Major mining area in very cloudy region in eastern Colombia. Rapid expansion in 2010s. Difficult imagery because of clouds.,,Colombia,S. Am,colombia_rio_quito_quibdo_agm_region,colombia_rio_quito_quibdo_agm_region,colombia_rio_quito_quibdo_agm_region
agm0053,colombia_rio_san_pedro_agm_region,colombia_rio_san_pedro_agm_region,,,,colombia_rio_san_pedro_agm_region,Colombia San Pedro,San Pedro,0,,1984,2008,Colombia,South America,Gold,,,2009,high,,No,No,NA,NA,No,,,,,,,,,Small mining area on small tributary stream.,,Colombia,S. Am,colombia_rio_san_pedro_agm_region,colombia_rio_san_pedro_agm_region,colombia_rio_san_pedro_agm_region
agm0054,colombia_rio_telembi_agm_region,colombia_rio_telembi_agm_region,,,,colombia_rio_telembi_agm_region,Colombia Telembi,Telembi,0,,1984,2010,Colombia,South America,Gold,,,2010,medium,,No,Yes,10,Approximate,No,,,,No,,,,,Small mining area. Seems to begin in 2010s. Sparse imagery.,,Colombia,S. Am,colombia_rio_telembi_agm_region,colombia_rio_telembi_agm_region,colombia_rio_telembi_agm_region
agm0055,colombia_rio_tigui_agm_region_TSTM,colombia_nechi,,,,,Colombia Nechi,Nechi,,,,,Colombia,South America,Gold,,,2009,high,,Yes,Yes,,,,,,,,,,,,Mining area in many tributaries upstream of main Nechi River mining area. Begins later than downstream mining districts. Begins in late 2000s and rapidly expands.,,Colombia,S. Am,colombia_nechi,colombia_nechi,
